{
  "$schema": "../../schemas/v1/sequence.schema.json",
  "id": "ubuntu-hydration",
  "version": "1",
  "entryMenu": "ubuntu-baseline",
  "output": "manifest",
  "finalApproval": true,
  "steps": [
    { "id": "bootstrap", "menuId": "bootstrap", "queue": "immediate", "packageIds": ["git", "go-task", "gum"] },
    { "id": "terminal", "menuId": "terminal", "queue": "on-confirm", "next": "file-managers" },
    { "id": "file-managers", "menuId": "file-managers", "queue": "on-confirm", "next": "editors" },
    { "id": "editors", "menuId": "editors", "queue": "on-confirm", "next": "browsers" },
    { "id": "browsers", "menuId": "browsers", "queue": "on-confirm", "next": "tiling" },
    { "id": "tiling", "menuId": "tiling", "queue": "on-confirm", "next": "speech" },
    { "id": "speech", "menuId": "speech", "queue": "on-confirm", "next": "agents" },
    { "id": "agents", "menuId": "agents", "queue": "on-confirm", "next": "toolchains" },
    { "id": "toolchains", "menuId": "toolchains", "queue": "on-confirm", "next": "validate" },
    { "id": "baseline", "menuId": "baseline-queue", "queue": "on-confirm", "packageIds": ["apt-support", "flatpak", "linuxbrew", "mise"] },
    { "id": "validate", "menuId": "validation", "queue": "on-confirm" }
  ]
}
